{
  "schemaVersion": 1,
  "intent": "create_building",
  "buildingType": "poor_worker_dormitory",
  "style": [
    "poor",
    "utilitarian"
  ],
  "floors": 2,
  "capacity": {
    "residents": 4
  },
  "requirements": {
    "bedrooms": 2,
    "entrances": 1,
    "storage": true
  },
  "preferences": {
    "centralCorridor": true,
    "compact": true,
    "bedroomsAwayFromEntrance": true
  },
  "seed": 1234
}
